{
  "$id": "https://symbolon.dev/schemas/v1/SignedReceipt.schema.json",
  "title": "SignedReceipt",
  "$schema": "https://json-schema.org/draft/2020-12/schema",
  "type": "object",
  "properties": {
    "receipt": {
      "type": "object",
      "properties": {
        "receiptVersion": {
          "type": "number",
          "const": 1
        },
        "decision": {
          "type": "object",
          "properties": {
            "decisionId": {
              "type": "string",
              "pattern": "^[0-9a-f]{8}-[0-9a-f]{4}-[1-8][0-9a-f]{3}-[89ab][0-9a-f]{3}-[0-9a-f]{12}$"
            },
            "tenantId": {
              "type": "string",
              "pattern": "^[0-9a-f]{8}-[0-9a-f]{4}-[1-8][0-9a-f]{3}-[89ab][0-9a-f]{3}-[0-9a-f]{12}$"
            },
            "intentId": {
              "type": "string",
              "pattern": "^0x[0-9a-f]{64}$"
            },
            "verdict": {
              "type": "string",
              "enum": [
                "RELEASE",
                "HOLD",
                "ESCALATE",
                "REJECT",
                "REPLAY"
              ]
            },
            "checks": {
              "maxItems": 32,
              "type": "array",
              "items": {
                "type": "object",
                "properties": {
                  "id": {
                    "type": "string",
                    "enum": [
                      "K-01",
                      "K-02",
                      "K-03",
                      "K-04",
                      "K-05",
                      "K-06",
                      "K-07",
                      "K-08",
                      "K-09",
                      "K-10",
                      "K-11",
                      "K-12",
                      "K-13",
                      "K-14",
                      "K-15",
                      "K-16"
                    ]
                  },
                  "name": {
                    "type": "string",
                    "enum": [
                      "STRICT_SCHEMA",
                      "PRECISION_EXACT",
                      "DOC_TYPE_SIGN",
                      "IDEMPOTENCY_DEDUPE",
                      "ENGAGEMENT_BINDING",
                      "PAYEE_BINDING",
                      "CURRENCY_DECIMALS",
                      "AMOUNT_CONFORMANCE",
                      "EVIDENCE_MATCH",
                      "EXTRACTION_CONSENSUS",
                      "INSTRUCTION_CHANGE_HEURISTIC",
                      "AUTHORITY_ENVELOPE",
                      "COUNTERPARTY_SCREEN",
                      "LIQUIDITY_AND_TIMING",
                      "RECONCILIATION_WITNESS",
                      "CIRCUIT_BREAKER"
                    ]
                  },
                  "status": {
                    "type": "string",
                    "enum": [
                      "PASS",
                      "FAIL",
                      "SKIP"
                    ]
                  },
                  "onFail": {
                    "anyOf": [
                      {
                        "type": "string",
                        "enum": [
                          "REJECT",
                          "ESCALATE",
                          "HOLD"
                        ]
                      },
                      {
                        "type": "null"
                      }
                    ]
                  },
                  "code": {
                    "anyOf": [
                      {
                        "type": "string",
                        "enum": [
                          "SCHEMA_INVALID",
                          "NON_ASCII_DIGITS",
                          "SCIENTIFIC",
                          "REFUSE_ROUND",
                          "AMOUNT_AMBIGUOUS",
                          "EXTRACTION_PARSE_MISMATCH",
                          "LINEITEM_SUM_MISMATCH",
                          "CREDIT_NOTE",
                          "NOT_PAYABLE",
                          "DUPLICATE_DOC",
                          "NEAR_DUPLICATE",
                          "MILESTONE_ALREADY_PAID",
                          "NO_ENGAGEMENT",
                          "ENGAGEMENT_INACTIVE",
                          "OUT_OF_WINDOW",
                          "MILESTONE_ORDER",
                          "UNKNOWN_MILESTONE",
                          "PAYEE_MISMATCH",
                          "ADDRESS_CHANGE_CLAIMED",
                          "PAYEE_CHANGE_PENDING",
                          "CURRENCY_UNSUPPORTED",
                          "DECIMALS_MISMATCH",
                          "SCALE_ABSURD",
                          "OVERPAY",
                          "UNDERPAY_PARTIAL",
                          "EVIDENCE_MISSING",
                          "EVIDENCE_FAILED",
                          "EVIDENCE_HASH_MISMATCH",
                          "EXTRACTION_DISAGREE",
                          "SINGLE_EXTRACTION",
                          "INSTRUCTION_IN_DOC",
                          "CAP_PER_TX",
                          "CAP_DAILY",
                          "CAP_WEEKLY",
                          "CATEGORY_BUDGET",
                          "VELOCITY",
                          "HUMAN_REQUIRED",
                          "FIRST_PAYMENT_LARGE",
                          "SCREENING_PENDING",
                          "SCREEN_HIT",
                          "SCREENING_DISABLED",
                          "LIQUIDITY",
                          "TIMING_CLAMPED",
                          "LATE",
                          "BREAKER_HALTED",
                          "KERNEL_ERROR",
                          "TERMS_NOT_SIGNED",
                          "TERMS_MISMATCH",
                          "DISCOUNT_WINDOW_CLOSED",
                          "EVIDENCE_SOURCE_DENIED",
                          "ESCALATION_BUDGET_EXCEEDED",
                          "PLAN_OUT_OF_ENVELOPE"
                        ]
                      },
                      {
                        "type": "null"
                      }
                    ]
                  },
                  "detail": {
                    "type": "string",
                    "maxLength": 2000
                  },
                  "refs": {
                    "maxItems": 32,
                    "type": "array",
                    "items": {
                      "type": "string",
                      "maxLength": 256
                    }
                  }
                },
                "required": [
                  "id",
                  "name",
                  "status",
                  "onFail",
                  "code",
                  "detail",
                  "refs"
                ],
                "additionalProperties": false
              }
            },
            "reasons": {
              "maxItems": 64,
              "type": "array",
              "items": {
                "type": "string",
                "enum": [
                  "SCHEMA_INVALID",
                  "NON_ASCII_DIGITS",
                  "SCIENTIFIC",
                  "REFUSE_ROUND",
                  "AMOUNT_AMBIGUOUS",
                  "EXTRACTION_PARSE_MISMATCH",
                  "LINEITEM_SUM_MISMATCH",
                  "CREDIT_NOTE",
                  "NOT_PAYABLE",
                  "DUPLICATE_DOC",
                  "NEAR_DUPLICATE",
                  "MILESTONE_ALREADY_PAID",
                  "NO_ENGAGEMENT",
                  "ENGAGEMENT_INACTIVE",
                  "OUT_OF_WINDOW",
                  "MILESTONE_ORDER",
                  "UNKNOWN_MILESTONE",
                  "PAYEE_MISMATCH",
                  "ADDRESS_CHANGE_CLAIMED",
                  "PAYEE_CHANGE_PENDING",
                  "CURRENCY_UNSUPPORTED",
                  "DECIMALS_MISMATCH",
                  "SCALE_ABSURD",
                  "OVERPAY",
                  "UNDERPAY_PARTIAL",
                  "EVIDENCE_MISSING",
                  "EVIDENCE_FAILED",
                  "EVIDENCE_HASH_MISMATCH",
                  "EXTRACTION_DISAGREE",
                  "SINGLE_EXTRACTION",
                  "INSTRUCTION_IN_DOC",
                  "CAP_PER_TX",
                  "CAP_DAILY",
                  "CAP_WEEKLY",
                  "CATEGORY_BUDGET",
                  "VELOCITY",
                  "HUMAN_REQUIRED",
                  "FIRST_PAYMENT_LARGE",
                  "SCREENING_PENDING",
                  "SCREEN_HIT",
                  "SCREENING_DISABLED",
                  "LIQUIDITY",
                  "TIMING_CLAMPED",
                  "LATE",
                  "BREAKER_HALTED",
                  "KERNEL_ERROR",
                  "TERMS_NOT_SIGNED",
                  "TERMS_MISMATCH",
                  "DISCOUNT_WINDOW_CLOSED",
                  "EVIDENCE_SOURCE_DENIED",
                  "ESCALATION_BUDGET_EXCEEDED",
                  "PLAN_OUT_OF_ENVELOPE"
                ]
              }
            },
            "engagementId": {
              "anyOf": [
                {
                  "type": "string",
                  "pattern": "^0x[0-9a-f]{64}$"
                },
                {
                  "type": "null"
                }
              ]
            },
            "milestoneId": {
              "anyOf": [
                {
                  "type": "string",
                  "pattern": "^0x[0-9a-f]{64}$"
                },
                {
                  "type": "null"
                }
              ]
            },
            "payee": {
              "anyOf": [
                {
                  "type": "string",
                  "pattern": "^0x[0-9a-fA-F]{40}$"
                },
                {
                  "type": "null"
                }
              ]
            },
            "amountBaseUnits": {
              "anyOf": [
                {
                  "type": "string",
                  "pattern": "^(0|[1-9][0-9]{0,29})$"
                },
                {
                  "type": "null"
                }
              ]
            },
            "payAt": {
              "anyOf": [
                {
                  "type": "string",
                  "pattern": "^(\\d{4})-(\\d{2})-(\\d{2})T(\\d{2}):(\\d{2}):(\\d{2})Z$"
                },
                {
                  "type": "null"
                }
              ]
            },
            "timingSource": {
              "anyOf": [
                {
                  "type": "string",
                  "enum": [
                    "AGENT",
                    "CLAMPED",
                    "DEFAULT"
                  ]
                },
                {
                  "type": "null"
                }
              ]
            },
            "releaseAmountBaseUnits": {
              "anyOf": [
                {
                  "type": "string",
                  "pattern": "^(0|[1-9][0-9]{0,29})$"
                },
                {
                  "type": "null"
                }
              ]
            },
            "planId": {
              "anyOf": [
                {
                  "type": "string",
                  "pattern": "^0x[0-9a-f]{64}$"
                },
                {
                  "type": "null"
                }
              ]
            },
            "plannerFallback": {
              "type": "boolean"
            },
            "invoiceReceivedAt": {
              "anyOf": [
                {
                  "type": "string",
                  "pattern": "^(\\d{4})-(\\d{2})-(\\d{2})T(\\d{2}):(\\d{2}):(\\d{2})Z$"
                },
                {
                  "type": "null"
                }
              ]
            },
            "policyHash": {
              "type": "string",
              "pattern": "^0x[0-9a-f]{64}$"
            },
            "kernelVersion": {
              "type": "string",
              "minLength": 1,
              "maxLength": 64
            },
            "patternsVersion": {
              "type": "string",
              "minLength": 1,
              "maxLength": 64
            },
            "contextHash": {
              "type": "string",
              "pattern": "^0x[0-9a-f]{64}$"
            },
            "agentRecommendation": {
              "anyOf": [
                {
                  "type": "object",
                  "properties": {
                    "verdict": {
                      "type": "string",
                      "enum": [
                        "RELEASE",
                        "HOLD",
                        "ESCALATE"
                      ]
                    },
                    "reasons": {
                      "maxItems": 10,
                      "type": "array",
                      "items": {
                        "type": "string",
                        "maxLength": 500
                      }
                    }
                  },
                  "required": [
                    "verdict",
                    "reasons"
                  ],
                  "additionalProperties": false
                },
                {
                  "type": "null"
                }
              ]
            },
            "supersedes": {
              "anyOf": [
                {
                  "type": "string",
                  "pattern": "^[0-9a-f]{8}-[0-9a-f]{4}-[1-8][0-9a-f]{3}-[89ab][0-9a-f]{3}-[0-9a-f]{12}$"
                },
                {
                  "type": "null"
                }
              ]
            },
            "createdAt": {
              "type": "string",
              "pattern": "^(\\d{4})-(\\d{2})-(\\d{2})T(\\d{2}):(\\d{2}):(\\d{2})Z$"
            }
          },
          "required": [
            "decisionId",
            "tenantId",
            "intentId",
            "verdict",
            "checks",
            "reasons",
            "engagementId",
            "milestoneId",
            "payee",
            "amountBaseUnits",
            "payAt",
            "timingSource",
            "releaseAmountBaseUnits",
            "planId",
            "plannerFallback",
            "invoiceReceivedAt",
            "policyHash",
            "kernelVersion",
            "patternsVersion",
            "contextHash",
            "agentRecommendation",
            "supersedes",
            "createdAt"
          ],
          "additionalProperties": false
        },
        "humanExplanationHash": {
          "anyOf": [
            {
              "type": "string",
              "pattern": "^0x[0-9a-f]{64}$"
            },
            {
              "type": "null"
            }
          ]
        },
        "inputs": {
          "type": "object",
          "properties": {
            "docHash": {
              "type": "string",
              "pattern": "^0x[0-9a-f]{64}$"
            },
            "extractionHashA": {
              "type": "string",
              "pattern": "^0x[0-9a-f]{64}$"
            },
            "extractionHashB": {
              "anyOf": [
                {
                  "type": "string",
                  "pattern": "^0x[0-9a-f]{64}$"
                },
                {
                  "type": "null"
                }
              ]
            },
            "promptHashA": {
              "type": "string",
              "pattern": "^0x[0-9a-f]{64}$"
            },
            "promptHashB": {
              "anyOf": [
                {
                  "type": "string",
                  "pattern": "^0x[0-9a-f]{64}$"
                },
                {
                  "type": "null"
                }
              ]
            },
            "modelA": {
              "type": "string",
              "minLength": 1,
              "maxLength": 128,
              "pattern": "^[A-Za-z0-9._:/@-]+$"
            },
            "modelB": {
              "anyOf": [
                {
                  "type": "string",
                  "minLength": 1,
                  "maxLength": 128,
                  "pattern": "^[A-Za-z0-9._:/@-]+$"
                },
                {
                  "type": "null"
                }
              ]
            },
            "evidence": {
              "maxItems": 64,
              "type": "array",
              "items": {
                "type": "object",
                "properties": {
                  "evidenceId": {
                    "type": "string",
                    "pattern": "^[0-9a-f]{8}-[0-9a-f]{4}-[1-8][0-9a-f]{3}-[89ab][0-9a-f]{3}-[0-9a-f]{12}$"
                  },
                  "payloadHash": {
                    "type": "string",
                    "pattern": "^0x[0-9a-f]{64}$"
                  },
                  "result": {
                    "type": "string",
                    "enum": [
                      "PASS",
                      "FAIL",
                      "ERROR"
                    ]
                  }
                },
                "required": [
                  "evidenceId",
                  "payloadHash",
                  "result"
                ],
                "additionalProperties": false
              }
            },
            "engagementTermsHash": {
              "anyOf": [
                {
                  "type": "string",
                  "pattern": "^0x[0-9a-f]{64}$"
                },
                {
                  "type": "null"
                }
              ]
            },
            "normalizedDocHash": {
              "type": "string",
              "pattern": "^0x[0-9a-f]{64}$"
            },
            "paymentTermsHash": {
              "anyOf": [
                {
                  "type": "string",
                  "pattern": "^0x[0-9a-f]{64}$"
                },
                {
                  "type": "null"
                }
              ]
            },
            "planEvaluationHash": {
              "anyOf": [
                {
                  "type": "string",
                  "pattern": "^0x[0-9a-f]{64}$"
                },
                {
                  "type": "null"
                }
              ]
            },
            "profile": {
              "type": "string",
              "enum": [
                "production",
                "sandbox"
              ]
            }
          },
          "required": [
            "docHash",
            "extractionHashA",
            "extractionHashB",
            "promptHashA",
            "promptHashB",
            "modelA",
            "modelB",
            "evidence",
            "engagementTermsHash",
            "normalizedDocHash",
            "paymentTermsHash",
            "planEvaluationHash",
            "profile"
          ],
          "additionalProperties": false
        },
        "issuedAt": {
          "type": "string",
          "pattern": "^(\\d{4})-(\\d{2})-(\\d{2})T(\\d{2}):(\\d{2}):(\\d{2})Z$"
        }
      },
      "required": [
        "receiptVersion",
        "decision",
        "humanExplanationHash",
        "inputs",
        "issuedAt"
      ],
      "additionalProperties": false
    },
    "receiptHash": {
      "type": "string",
      "pattern": "^0x[0-9a-f]{64}$"
    },
    "signature": {
      "type": "string",
      "maxLength": 8194,
      "pattern": "^0x(?:[0-9a-f]{2})*$"
    },
    "signer": {
      "type": "string",
      "pattern": "^0x[0-9a-fA-F]{40}$"
    }
  },
  "required": [
    "receipt",
    "receiptHash",
    "signature",
    "signer"
  ],
  "additionalProperties": false
}
